{
  "id": "i_type_b_002",
  "template_id": "tpl_type_b",
  "content_version": 1,
  "type": "TYPE_B",
  "title": "Type B â€“ Sample 2",
  "content": { "html": "Compute \\(. 3 + 2 \\)." },
  "media": [],
  "steps": [
    {
      "step_id": "s1",
      "prompt": { "html": "What is 3 + 2?" },
      "choices": [
        { "id": "A", "text": "4" },
        { "id": "B", "text": "5" },
        { "id": "C", "text": "6" },
        { "id": "D", "text": "7" }
      ]
    }
  ],
  "final": { "answer_text": "5", "explanation": { "html": "3 + 2 = 5." } },
  "tags": { "skill": "skill_b", "difficulty": "E" },
  "generated_at": "2025-10-17T00:00:00Z",
  "generator_version": "mock-1"
}


