{
  "id": "i_type_c_001",
  "template_id": "tpl_type_c",
  "content_version": 1,
  "type": "TYPE_C",
  "title": "Type C â€“ Sample 1",
  "content": { "html": "Compute \\(. 10 - 5 \\)." },
  "media": [],
  "steps": [
    {
      "step_id": "s1",
      "prompt": { "html": "What is 10 - 5?" },
      "choices": [
        { "id": "A", "text": "4" },
        { "id": "B", "text": "5" },
        { "id": "C", "text": "6" },
        { "id": "D", "text": "7" }
      ],
      "correct_choice_id": "B"
    }
  ],
  "final": { "answer_text": "5", "explanation": { "html": "10 - 5 = 5." } },
  "tags": { "skill": "skill_c", "difficulty": "E" },
  "generated_at": "2025-10-17T00:00:00Z",
  "generator_version": "mock-1"
}


