{
  "id": "i_456",
  "template_id": "tpl_parallel_lines_v1",
  "content_version": 203,
  "type": "PARALLEL_LINE_FIND_X",
  "title": "Parallel Lines - Find x",
  "content": { "html": "Find \\(? x \\)?." },
  "media": [
    { "id": "fig1", "object_key": "items/tpl_parallel_lines_v1/fig1.svg", "alt": "Two parallel lines with a transversal" }
  ],
  "steps": [
    {
      "step_id": "s1",
      "prompt": { "html": "Is 128째 large (obtuse) or small (acute)?" },
      "choices": [
        { "id": "A", "text": "Big" },
        { "id": "B", "text": "Little" }
      ],
      "hint": "Little < 90째, big > 90째."
    }
  ],
  "final": { "answer_text": "x = 128째", "explanation": { "html": "..." } },
  "tags": { "skill": "parallel_lines", "difficulty": "M" },
  "generated_at": "2025-10-09T12:00:00Z",
  "generator_version": "v1.0.0",
  "variant_index": 1
}
